<?xml version="1.0" encoding="UTF-8"?>
<!DOCTYPE Post
  SYSTEM 'postprofile.dtd'>
	<Post>
		<No>348</No>
		<PostUser>User0</PostUser>
		<Block>School Life</Block>
		<Title>≤‚ ‘2</Title>
		<Content>≤‚ ‘2</Content>
		<PostTime>2018-12-31 19:54:09</PostTime>
		<Clicks>1</Clicks>
		<ReplyNum>0</ReplyNum>
		<Replies/>
	</Post>
