<?xml version="1.0" encoding="UTF-8"?>
<!DOCTYPE Post
  SYSTEM 'postprofile.dtd'>
	<Post>
		<No>347</No>
		<PostUser>User0</PostUser>
		<Block>School Life</Block>
		<Title>▓Р╩н </Title>
		<Content>▓Р╩нол╬─</Content>
		<PostTime>2018-12-31 19:46:35</PostTime>
		<Clicks>2</Clicks>
		<ReplyNum>0</ReplyNum>
		<Replies/>
	</Post>
